StoreName,CityName,Street Address,Longitude,Latitude,province,cityE
镇江北固湾店,镇江市,"江苏省镇江市, 京口区中山东路301号604铺位",119.47,32.22,Jiangsu,Zhenjiang
镇江苏宁广场6F店,镇江市,"江苏省镇江市, 黄山西路19号",119.45,32.2,Jiangsu,Zhenjiang
镇江万达店,镇江市,"润州区, 万达广场, 谷阳中大道75号L1-001单元",119.44,32.2,Jiangsu,Zhenjiang
镇江宝龙广场店,镇江市,"丹徒区, 镇江宝龙广场, 桑园路1号660铺位",119.45,32.13,Jiangsu,Zhenjiang
南京东郊奥特莱斯店,镇江市,"句容市郭庄镇空港新区, 中山东路254号",119.01,31.81,Jiangsu,Zhenjiang
镇江商业城店,镇江市,"京口区, 镇江商业购物广场, 金陵西路88号1F-011铺位",119.45,32.21,Jiangsu,Zhenjiang
镇江丹阳吾悦广场店,镇江市,"丹阳市开发区, 新民东路99号10#-102铺位",119.61,32.0,Jiangsu,Zhenjiang
丹阳金鹰天地店,镇江市,"丹阳市, 金鹰天地广场",119.58,31.99,Jiangsu,Zhenjiang
泰州靖江泰和国际城店,靖江市,车站路77号泰和国际城C1-01铺位,120.26,32.01,,
泰州靖江文峰大世界店,靖江市,"人民北路1号文峰大世界1层1-2单元, 通湖路333号",120.27,32.02,,
扬州高邮世贸广场店,高邮市,"江苏省扬州高邮市, 世贸广场一层A005/A006/A1015铺位",119.46,32.79,,
Hangzhou Kerry Central NO.1 Store,Hangzhou,"intersection Yanan Road and Qingchun Roa, xiacheng",120.16,30.26,,
Hangzhou Dahua Xixifengqing-1F2F,Hangzhou,"West Wenyi Rd&Yongfu Rd, Yu Hang District",120.04,30.28,,
Hangzhou Tianyang D32 - GF,hangzhou,"xiao he road, gong shu",120.14,30.31,,
Hangzhou Lanzuantiancheng - GF,hangzhou,"pin shui road, gongshu",120.12,30.31,,
Ningbo Bali Sunday - GF,hangzhou,"NO.555 qian hu south road, yin zhou",121.57,29.83,,
JX Jiashan Pacific Square Store-GF,Jiaxing,"Jiashan Century Avenue Rd intersection, Jiashan",120.93,30.82,,
JX TX Dongxing Living Mall Store-GF,Jiaxing,"North Qingfeng Road North Huancheng Road, Tongxiang",120.55,30.65,,
Jinhua  Center hospital - GF,jin hua,"NO.351 Mingyue street, wu cheng",119.66,29.11,,
Jinhua Wuyi Hushan Plaza-GF,Jinhua,"Yu Yuan Street&Venus Lane, Wuyi",119.81,28.89,,
NB Ninghai Taiyue City-GF,Ningbo,"Middle Xingning road and outer ring road, Ninghai County",121.43,29.3,,
NB Yuyao Eton Store-GF,Ningbo,"South Xin Ximen Rd&West Siming Rd, Yu Yao",121.15,30.03,,
NB Xiangshan Pacific Square-GF,Ningbo,"Eagle Road Danfeng Road, Xiangshan County",121.9,29.48,,
WZ World Trade Fashion Center- GF,Wenzhou,"Da Nan RD&East Maanchi Rd, Lucheng District",120.66,28.01,,
ZS Dinghai Kaihong Plaza-1F2F,Zhoushan,"Chang Zhou Avenue Dongying Road, Dinghai District",122.12,30.02,,
上虞老大通店,上虞市,"人民中路193号, 市民大道689号1F32",120.88,30.02,,
上虞大通购物中心店,上虞市,"上虞区, 大通购物中心",120.87,30.03,,
东阳一百店,东阳市,人民路106号,120.24,29.27,,
丽水金汇广场店,丽水市,"莲都区解放街198号一层1号101室, 花园路36号，万地广场一楼",119.92,28.45,Zhejiang,Lishui
丽水万地广场店,丽水市,"莲都区, 万地广场",119.92,28.46,Zhejiang,Lishui
临海耀达百货店,临海市,"靖江中路122号, 临海银泰城",121.14,28.85,,
临海银泰城店,临海市,"东方大道1号, 工人北路2号",121.14,28.86,,
义乌颐和店,义乌市,"义乌, 颐和大酒店一楼, 工人西路15号",120.08,29.31,,
义乌银泰伊美店,义乌市,"婺城区, 泰百货义乌伊美店一楼, 乐清南虹广场",120.07,29.31,,
乐清南虹广场店,乐清市,伯乐东路666号,120.98,28.11,,
余姚五彩城店,余姚市,"城东路888号1F-117, 嘉泰新时代购物中心",121.18,30.07,,
金华兰溪嘉泰店,兰溪市,"丹溪大道157号, 市府大道289号",119.45,29.21,,
台州耀达百货店,台州市,"椒江区, 台州市耀达商城, 天和路88号",121.43,28.65,Zhejiang,Taizhou
台州意得店,台州市,"椒江区, 椒江区解放南路251,255号",121.41,28.65,Zhejiang,Taizhou
台州椒江锦江百货店,台州市,"浙江省台州市, 黄岩书城A-001商铺",121.44,28.67,Zhejiang,Taizhou
台州黄岩书城店,台州市,"黄岩区西城街道引泉路188号, 椒江区开发大道799号一层1001铺位",121.26,28.63,Zhejiang,Taizhou
台州经开万达店,台州市,"浙江省台州市, 天台太平洋购物中心",121.42,28.64,Zhejiang,Taizhou
台州天台太平洋店,台州市,"天台县赤城路399号, 东森购物中心B101单元及B206单元",121.03,29.14,Zhejiang,Taizhou
台州东森店,台州市,"东森购物中心, 椒江区中心大道3899号",121.37,28.59,Zhejiang,Taizhou
台州椒江银泰城店,台州市,"浙江省台州市, 银泰城1楼141单元, 腾达路699号",121.4,28.62,Zhejiang,Taizhou
台州世贸中心店,台州市,"路桥区, 银座街508号中盛百货A座一层1A01号商铺",121.37,28.59,Zhejiang,Taizhou
台州中盛城市广场店,台州市,"台州市路桥区, 路桥区, 临海市大洋街道桥东村(台州服务区东区101号）",121.38,28.58,Zhejiang,Taizhou
台州服务区东区店,台州市,"浙江省台州市, 海宁市海宁大道302号一层101单元",121.23,28.88,Zhejiang,Taizhou
嘉兴海宁皮都锦江大酒店店,嘉兴,"浙江省嘉兴, 秀洲区中山西路1911号147室",120.67,30.5,,
嘉兴中关村店,嘉兴市,"浙江省嘉兴市, 嘉善县谈公北路18号一层一单元",120.69,30.76,Zhejiang,Jiaxing
嘉兴嘉善东方大厦店,嘉兴市,"浙江省嘉兴市, 洪兴西路1732号",120.93,30.84,Zhejiang,Jiaxing
嘉兴江南摩尔店,嘉兴市,"秀洲区, 江南摩尔, 王店镇建农村（沪杭高速嘉兴服务区北区）",120.71,30.76,Zhejiang,Jiaxing
G60高速嘉兴服务区北区店,嘉兴市,"秀洲区, 广益路1108号",120.67,30.62,Zhejiang,Jiaxing
嘉兴万达广场店,嘉兴市,"南湖区, 嘉兴万达广场, 新桥北路231号",120.8,30.74,Zhejiang,Jiaxing
嘉兴海盐嘉凯城店,嘉兴市,"浙江省嘉兴市海盐县, 一层1067号商铺, 公园路22号",120.95,30.54,Zhejiang,Jiaxing
桐乡新卉店,嘉兴市,"桐乡市, 中山东路666号S1F-23、24",120.55,30.63,Zhejiang,Jiaxing
嘉兴旭辉广场店,嘉兴市,"南湖区, 嘉兴旭辉广场",120.75,30.76,Zhejiang,Jiaxing
海宁银泰城店,嘉兴市,"海昌南路365号, 西塘镇璞悦园",120.69,30.5,Zhejiang,Jiaxing
嘉善西塘水街店,嘉兴市,"西塘镇环镇北路55号璞悦园12幢A16号商铺, 王店镇建农村（沪杭高速嘉兴服务区南区）",120.89,30.95,Zhejiang,Jiaxing
G60高速嘉兴服务区南区店,嘉兴市,"秀洲区, 嘉善区西塘镇南苑路",120.68,30.62,Zhejiang,Jiaxing
嘉兴嘉善西塘南门店,嘉兴市,"浙江省嘉兴市, 258号6幢101室, 南湖区越秀南路968号一层L1010商铺",120.89,30.94,Zhejiang,Jiaxing
嘉兴八佰伴店,嘉兴市,"浙江省嘉兴市, 海宁正翔商业广场1层1021商铺",120.73,30.76,Zhejiang,Jiaxing
嘉兴海宁正翔店,嘉兴市,"联合路97号, 海宁正翔商业广场",120.68,30.52,Zhejiang,Jiaxing
嘉善恒利广场店,嘉善市,"嘉善县中山西路118号, 太平洋百货广场",120.92,30.84,,
奉化太平洋百货店,奉化市,"南山路174号S1F-9商铺, 南山路150号",121.41,29.67,,
奉化银泰店,奉化市,"上城区, 银泰百货, 宁波书城文化广场1幢1、2、 3、 4号1-1-3",121.41,29.66,,
宁波书城店,宁波市,"江东区, 钱湖北路399号",121.57,29.88,Zhejiang,Ningbo
宁波钱湖天地店,宁波市,"鄞州区, 钱湖天地一楼, 中兴路268号一层1-84#室",121.57,29.83,Zhejiang,Ningbo
宁波江东天伦店,宁波市,"江东区, 宁波天伦时代广场, 海曙区开明街324号",121.59,29.87,Zhejiang,Ningbo
宁波天一开明街店,宁波市,"浙江省宁波市, Ib106、Ib204、205室, 泰安中路466号S104",121.55,29.87,Zhejiang,Ningbo
宁波汇港大厦店,宁波市,"鄞州区, 汇港大厦, 鄞县大道东段1288号南苑环球酒店大堂西入口南侧商铺",121.55,29.8,Zhejiang,Ningbo
宁波南苑环球酒店店,宁波市,"鄞州区, 宁波南苑环球酒店, 中山东路188号",121.55,29.82,Zhejiang,Ningbo
宁波天一广场店,宁波市,"海曙区, 天一广场VB区, 四明中路999号",121.56,29.87,Zhejiang,Ningbo
宁波银泰万达店,宁波市,"鄞州区, 万达广场银泰百货1F, 扬帆路999弄48号",121.55,29.83,Zhejiang,Ningbo
宁波研发园店,宁波市,"高新区, 宁波研发园B区7号楼1楼, 和义路100号F101室",121.64,29.89,Zhejiang,Ningbo
宁波和义1844店,宁波市,"海曙区, 宁波和义1844, 天童南路1088号1F-115室",121.55,29.88,Zhejiang,Ningbo
宁波银泰环球城1店,宁波市,"鄞州区, 宁波银泰环球城, 大庆南路99号",121.55,29.8,Zhejiang,Ningbo
宁波来福士店,宁波市,"江北区, 来福士L102, 宁海县正学东路1号1层31号铺",121.56,29.88,Zhejiang,Ningbo
宁波宁海西子国际店,宁波市,"浙江省宁波市, 富邦街62号3单元",121.44,29.3,Zhejiang,Ningbo
宁波北仑富邦店,宁波市,"北仑区, 北仑富邦商业广场",121.84,29.9,Zhejiang,Ningbo
宁波亿彩购物中心店,宁波市,"海曙区日新街105号1F-17商铺, 中山东路1999号2号楼",121.56,29.87,Zhejiang,Ningbo
宁波文化广场店,宁波市,"江东区, 文化广场, 镇明路568号A栋1-1室",121.62,29.86,Zhejiang,Ningbo
宁波海曙镇明路店,宁波市,"海曙区, 宁波月湖星汇金座, 中山东路1083号1A-07室",121.55,29.87,Zhejiang,Ningbo
宁波江东银泰店,宁波市,"江东区, 世纪东方商业广场, 鄞州区泰康中路455号",121.44,29.3,Zhejiang,Ningbo
宁波旅游大厦店,宁波市,"浙江省宁波市, 江北大道188号1F",121.55,29.81,Zhejiang,Ningbo
宁波江北万达店,宁波市,"江北区, 宁波江北万达, 首南街道街",121.53,29.91,Zhejiang,Ningbo
宁波南部商务区2店,宁波市,"鄞州区, 天智巷75弄2号, 彩虹北路42号",121.55,29.81,Zhejiang,Ningbo
宁波波特曼店,宁波市,"江东区, 波特曼, 中河路399号",121.57,29.87,Zhejiang,Ningbo
宁波北仑银泰城店,宁波市,"北仑区, 中山东路137号",121.83,29.9,Zhejiang,Ningbo
宁波新世界汇美店,宁波市,"海曙区, 新世界",121.55,29.87,Zhejiang,Ningbo
宁波月湖金贸大厦店,宁波市,"海曙区柳汀街225号店1-09、2-05室, 钱湖北路288号",121.54,29.87,Zhejiang,Ningbo
宁波印象城店,宁波市,"鄞州区, 宁波印象城",121.57,29.83,Zhejiang,Ningbo
宁波学府一号店,宁波市,"鄞州区钱湖南路636号109室, 宁波月湖盛园",121.56,29.81,Zhejiang,Ningbo
宁波月湖盛园店,宁波市,"盛园巷17号, 1F/2F, 江南路1106号",121.55,29.86,Zhejiang,Ningbo
宁波皇冠大厦店,宁波市,"高新区, 皇冠大厦一楼, 中山东路285号",121.62,29.89,Zhejiang,Ningbo
宁波金光百货店,宁波市,"江东区, 天童南路1088号4F-419室",121.56,29.87,Zhejiang,Ningbo
宁波银泰环球城2店,宁波市,"鄞州区, 宁波银泰环球城, 海曙区丽园南路1036号1-20A室",121.54,29.8,Zhejiang,Ningbo
宁波海曙恒一广场店,宁波市,"浙江省宁波市, 药行街152号1楼",121.51,29.85,Zhejiang,Ningbo
宁波天一2店,宁波市,"海曙区, 酷购商城, 中山中路1号",121.55,29.87,Zhejiang,Ningbo
宁海太平洋国购店,宁波市,"宁海县, 宁海太平洋国购, 长兴东路368号江北恒一广场1F 1-17",121.43,29.3,Zhejiang,Ningbo
宁波江北恒一广场店,宁波市,"浙江省宁波市江北区, 海曙区江厦街23号1A-5单元",121.5,29.93,Zhejiang,Ningbo
宁波东门银泰店,宁波市,"浙江省宁波市, 新碶长江路465-469号",121.56,29.87,Zhejiang,Ningbo
宁波北仑长江国际店,宁波市,"北仑区, 宁波北仑长江国际, 四明中路999号",121.85,29.91,Zhejiang,Ningbo
宁波鄞州万达店,宁波市,"鄞州区, 室内步行街一层1A-41-1号, 桑田路299号FF-02室",121.54,29.83,Zhejiang,Ningbo
宁波江东桑田路店,宁波市,"江东区, 华润万家生活超市, 府桥街37号",121.59,29.87,Zhejiang,Ningbo
宁波鼓楼店,宁波市,"海曙区, 鼓楼1F, 江北外马路123号",121.55,29.87,Zhejiang,Ningbo
宁波老外滩店,宁波市,"江北区, 宁波老外滩, 中官西路777号科创大厦101室",121.56,29.88,Zhejiang,Ningbo
宁波镇海大学科技园店,宁波市,"镇海区, 宁波国家大学科技园, 日丽中路南部商务区水街6号楼6102及6202单元",121.61,29.91,Zhejiang,Ningbo
宁波水街店,宁波市,"鄞州区, 水街, 中山东路1083号",121.55,29.81,Zhejiang,Ningbo
宁波世纪东方广场店,宁波市,"江东区, 世纪东方广场一楼F1016号商铺, 和义路76号1041A",121.59,29.86,Zhejiang,Ningbo
宁波和义大道店,宁波市,"海曙区, 和义大道",121.56,29.87,Zhejiang,Ningbo
宁波鄞州天旋巷店,宁波市,"鄞州区四明中路688号F1-07室, 健康路157号",121.55,29.83,Zhejiang,Ningbo
余姚舜大店,宁波市,"余姚市, 舜大, 江东区江东北路街",121.16,30.05,Zhejiang,Ningbo
宁波和丰创意广场店,宁波市,"浙江省宁波市, 425号004幢1-1单元",121.57,29.88,Zhejiang,Ningbo
宁波天一国购店,宁波市,"海曙区中山东路166号一楼020-1号位, 宁波象山国际风情街",121.55,29.87,Zhejiang,Ningbo
宁波象山风情街店,宁波市,"象山县丹河东路905-1号, 新星路111号",121.9,29.46,Zhejiang,Ningbo
宁波高鑫广场店,宁波市,"海曙区, 江东区徐戎路（临）39号4号楼101室",121.53,29.9,Zhejiang,Ningbo
宁波集盒店,宁波市,"浙江省宁波市, 四明西路855号",121.57,29.87,Zhejiang,Ningbo
余姚万达店,宁波市,"余姚市, 万达广场, 北岸财富中心120号",121.13,30.03,Zhejiang,Ningbo
宁波北岸财富中心店,宁波市,"江北区, 南塘河街260号",121.55,29.89,Zhejiang,Ningbo
宁波南塘老街店,宁波市,"海曙区, 泰康东路199号宁波诺丁汉大学5号教学楼118室",121.54,29.85,Zhejiang,Ningbo
宁波诺丁汉大学店,宁波市,"鄞州区, 宁波诺丁汉大学, 镇海区庄市大道1088号F120铺",121.56,29.8,Zhejiang,Ningbo
宁波镇海万科1902店,宁波市,"浙江省宁波市, 鄞州区钱湖南路1号浙江大学宁波理工学院",121.63,29.93,Zhejiang,Ningbo
浙大宁波理工学院店,宁波市,"浙江省宁波市, 图书馆1楼1室, 华润万家",121.58,29.81,Zhejiang,Ningbo
慈溪新城大道北路店,慈溪市,"新城大道北路269-325号1F-05A, 青少年宫南路99号",121.27,30.17,,
慈溪银泰店,慈溪市,"浒山街道, 银泰",121.25,30.17,,
慈溪绿城慈园店,慈溪市,浒山路256~262号,121.26,30.17,,
慈溪嘉丽环球中心店,慈溪市,"水门路3号, 慈溪滨湖天地购物中心",121.24,30.17,,
慈溪保利广场店,慈溪市,"三北西大街1151、1553号A1-20a, 五常大道1号",121.21,30.18,,
杭州西溪印象城店,杭州市,"余杭区, 杭州西溪印象城, 环城北路230号",120.05,30.25,Zhejiang,Hangzhou
杭州大厦C座店,杭州市,"下城区, 杭州大厦C座2F, 滨江区阡陌路459号聚光中心A座101室",120.16,30.27,Zhejiang,Hangzhou
杭州聚光科技店,杭州市,"浙江省杭州市, 台州路2号运河上街商业中心151铺位",120.22,30.21,Zhejiang,Hangzhou
杭州运河上街店,杭州市,"拱墅区, 北干街道市心中路618号",120.14,30.32,Zhejiang,Hangzhou
萧山宝盛宾馆店店,杭州市,"杭州市萧山区, 萧山区, 杭行路666号拱墅万达广场一层1001号铺位",120.27,30.18,Zhejiang,Hangzhou
杭州拱墅万达店,杭州市,"拱墅区, 拱墅万达广场, 城星路59号东杭大厦一层2号商铺",120.12,30.33,Zhejiang,Hangzhou
杭州东杭大厦店,杭州市,"江干区, 杭州东杭大厦, 飞云江路19号",120.21,30.24,Zhejiang,Hangzhou
杭州赞成太和广场店,杭州市,"上城区, 太和广场, 教工路26号",120.18,30.22,Zhejiang,Hangzhou
杭州EAC店,杭州市,"西湖区, 世贸丽晶城欧美中心2号楼G区107,108室, 杭大路15号1-2F",120.14,30.27,Zhejiang,Hangzhou
杭州嘉华店,杭州市,"西湖区, 杭州嘉华, 江南大道228号",120.14,30.27,Zhejiang,Hangzhou
杭州星光大道店,杭州市,"滨江区, 星光国际广场1-101＆1-201, 解放东路29号迪凯银座104室",120.21,30.21,Zhejiang,Hangzhou
杭州迪凯银座店,杭州市,"杭州市江干区, 灵隐路36-2号",120.21,30.24,Zhejiang,Hangzhou
杭州灵隐路店,杭州市,"西湖区, 灵隐路, 金沙大道560号龙湖金沙天街1F-054和2F-052A",120.11,30.24,Zhejiang,Hangzhou
杭州下沙龙湖店,杭州市,"经济技术开发区, 杭州下沙龙湖金沙天街, 西兴街道滨康路228号3幢A座101室-102室",120.33,30.31,Zhejiang,Hangzhou
杭州万福中心店,杭州市,"滨江区, 杭州万福中心, 市民中心H座地下一层3、4、5号商铺",120.21,30.18,Zhejiang,Hangzhou
杭州市民中心店,杭州市,"江干区, 上城区钱江路407号",120.21,30.25,Zhejiang,Hangzhou
杭州望江府店,杭州市,"浙江省杭州市, 藕花洲大街303号莱蒙商业广场1-1商铺",120.19,30.23,Zhejiang,Hangzhou
杭州临平莱蒙商业广场店,杭州市,"余杭区, 莱蒙商业广场, 江汉路1785号",120.3,30.42,Zhejiang,Hangzhou
杭州滨江网新店,杭州市,"滨江区, 网新.双城大厦4号楼1层4-101, 江干区新风路619号",120.2,30.21,Zhejiang,Hangzhou
杭州城东汇和城店,杭州市,"浙江省杭州市, 汇和城第一层1050号商铺和第二层2060号商铺, 三墩镇厚仁路339-341号",120.21,30.29,Zhejiang,Hangzhou
杭州303生活广场店,杭州市,"西湖区, 杭州303生活广场, 延安路292号工联大厦一至二层",120.08,30.33,Zhejiang,Hangzhou
杭州工联大厦店,杭州市,"上城区, 杭州工联大厦, 学院路77号黄龙国际中心H楼101室",120.16,30.25,Zhejiang,Hangzhou
杭州新芯智谷GHI店,杭州市,"西湖区, 杭州黄龙国际中心, 蕙兰雅路388号3幢129、130室",120.13,30.28,Zhejiang,Hangzhou
杭州丁兰广场店,杭州市,"江干区, 丁兰广场, 博卡路16号杭州博货国际购物广场",120.23,30.35,Zhejiang,Hangzhou
杭州博货国际购物广场店,杭州市,"余杭区, 博美商城16-1-106商铺, 上城区延安路278号第一层A108号商铺",120.29,30.34,Zhejiang,Hangzhou
杭州湖滨银泰C区店,杭州市,"浙江省杭州市, 解百新世纪第GF层",120.16,30.25,Zhejiang,Hangzhou
杭州解百新世纪店,杭州市,"上城区解放路249号, 及第1F层的002/101号商铺, 余杭塘路515号矩阵国际中心1号写字楼大堂内1-01部位",120.17,30.25,Zhejiang,Hangzhou
杭州矩阵国际店,杭州市,"拱墅区, 杭州矩阵国际, 万华广场1-016号铺位",120.11,30.29,Zhejiang,Hangzhou
杭州临安万华广场店,杭州市,"临安市钱王街855号, 上城区中山南路77号第1-18、1-20号铺位",119.71,30.22,Zhejiang,Hangzhou
杭州利星1157店,杭州市,浙江省杭州市,120.17,30.23,Zhejiang,Hangzhou
杭州萧山宝龙店,杭州市,"萧山区金鸡路1057、1059、1061号, 2号大街999号天和达城一至二层",120.25,30.2,Zhejiang,Hangzhou
杭州下沙和达城店,杭州市,"经济技术开发区, 下沙和达城, 4号大街505-1号",120.35,30.31,Zhejiang,Hangzhou
杭州下沙上品店,杭州市,"经济技术开发区, 上品商业, 桐庐县迎春南路666号",120.35,30.31,Zhejiang,Hangzhou
杭州桐庐利时广场店,杭州市,"浙江省杭州市, 桐庐利时广场1楼109室, 良渚街道古墩路1888号永旺梦乐城",119.69,29.8,Zhejiang,Hangzhou
杭州永旺梦乐城店,杭州市,"余杭区, 1F-171号商铺, 北山街82号",120.06,30.36,Zhejiang,Hangzhou
杭州曲院风荷店,杭州市,"西湖区, 曲院风荷竹素园商业网点, 富春路701号",120.13,30.25,Zhejiang,Hangzhou
杭州万象城店,杭州市,"江干区, 杭州万象城B1层B151号商铺, 朝晖路205号深蓝广场108商铺",120.22,30.25,Zhejiang,Hangzhou
杭州深蓝广场店,杭州市,"下城区, 杭州深蓝广场, 天城路1号",120.17,30.28,Zhejiang,Hangzhou
杭州东站到达区店,杭州市,"江干区, 火车东站地下一层HD-B1-01星巴克, 湖滨路1号",120.21,30.29,Zhejiang,Hangzhou
杭州湖滨路店,杭州市,"上城区, 湖滨路, 华联时代大厦A幢103-1室",120.16,30.25,Zhejiang,Hangzhou
杭州UDC店,杭州市,"江干区, UDC时代大厦, 西湖区转塘街道双流689号",120.22,30.25,Zhejiang,Hangzhou
杭州转塘金街美地店,杭州市,"浙江省杭州市, 金街美地商业中心一号楼101室, 建德市新安江街道盛德国际广场4幢4",120.08,30.15,Zhejiang,Hangzhou
杭州建德太平洋购物中心店,杭州市,"浙江省杭州市, 1030号、4,1031号、4,1032号、4,1033号、4,1034号商铺, 富春路701号B1层B1S08号商铺",119.28,29.47,Zhejiang,Hangzhou
杭州万象城二店,杭州市,"江干区, 杭州万象城, 新塘路108号天虹购物中心的B座楼一层131号商铺",120.21,30.25,Zhejiang,Hangzhou
杭州天虹店,杭州市,"江干区, 天虹商场, 滨江区江南大道618号",120.21,30.26,Zhejiang,Hangzhou
杭州东冠大厦店,杭州市,"浙江省杭州市, 祥园路99号",120.2,30.2,Zhejiang,Hangzhou
杭州北部软件园店,杭州市,"杭州市拱墅区, 101、103商铺, 天目山路274号",120.12,30.34,Zhejiang,Hangzhou
杭州黄龙时代广场店,杭州市,"西湖区, 海创园1F",120.13,30.27,Zhejiang,Hangzhou
杭州海创园店,杭州市,"文一西路998号, 滨安路1190号3幢",120.02,30.28,Zhejiang,Hangzhou
杭州智汇中心店,杭州市,"滨江区, 平海路124号",120.18,30.19,Zhejiang,Hangzhou
杭州凯悦店,杭州市,"上城区, 利星名品广场, 良渚文化村食街",120.16,30.25,Zhejiang,Hangzhou
杭州良渚文化村店,杭州市,"杭州市余杭区, 2-01、2-08号单元, 北山街9号",120.03,30.36,Zhejiang,Hangzhou
杭州断桥店,杭州市,"西湖区, 蒋经国故居副楼, 古墩路588号",120.15,30.26,Zhejiang,Hangzhou
杭州古墩印象城,杭州市,"余杭区, 杭州古墩印象城一楼, 西溪天堂国际旅游综合体20号-10",120.1,30.29,Zhejiang,Hangzhou
杭州西溪天堂店,杭州市,"西湖区, 城星路125号",120.09,30.27,Zhejiang,Hangzhou
杭州滨江城市之星店,杭州市,"江干区, 杭州滨江城市之星, 西湖区紫霞街155号",120.2,30.24,Zhejiang,Hangzhou
杭州西溪诚品店,杭州市,"浙江省杭州市, 西溪诚品1号楼103-01号商铺, 环城北路258号",120.07,30.29,Zhejiang,Hangzhou
杭州大厦D座店,杭州市,"下城区, 杭州大厦, 金城路333号",120.16,30.27,Zhejiang,Hangzhou
萧山城市生活广场店,杭州市,"萧山区, 城市生活广场店, 机场路119-131号第一层A-15号商铺",120.25,30.18,Zhejiang,Hangzhou
杭州天城国际店,杭州市,"杭州市江干区, 江干区, 杭州火车东站3F-HD-55号",120.19,30.29,Zhejiang,Hangzhou
杭州东站出发夹层店,杭州市,"江干区天城路1号, 火车东站东广场",120.21,30.29,Zhejiang,Hangzhou
杭州火车东站东广场店,杭州市,"杭州市江干区, 地下一层C01号商铺, 海达南路397号一层1A-01号单元",120.21,30.29,Zhejiang,Hangzhou
杭州下沙银泰城店,杭州市,"经济技术开发区, 北山街87号-5",120.33,30.3,Zhejiang,Hangzhou
杭州北山路店,杭州市,"西湖区, 秀水广场A-1营业房",120.13,30.25,Zhejiang,Hangzhou
杭州千岛湖秀水广场店,杭州市,"淳安县千岛湖镇阳光路89号, 萧山国际机场T3航站楼出发层禁区内",119.04,29.62,Zhejiang,Hangzhou
萧山机场出发禁区店,杭州市,"萧山区, 萧山国际机场T3, 湖墅南路90号",120.44,30.24,Zhejiang,Hangzhou
杭州苏宁生活广场店,杭州市,"拱墅区, 杭州苏宁生活广场, 上塘路158号省人民医院1号楼一层",120.16,30.28,Zhejiang,Hangzhou
杭州浙江省人民医院店,杭州市,"下城区, 浙江省人民医院, 桐庐县江南镇小潘村",120.17,30.29,Zhejiang,Hangzhou
G25高速桐庐服务区南区店,杭州市,"浙江省杭州市, （桐庐服务区南区N02商铺）, 景昙路9号西子国际中心一层第1018号商铺",119.8,29.84,Zhejiang,Hangzhou
杭州501城市广场1F店,杭州市,"杭州市江干区, 江干区, 体育场路178号",120.2,30.26,Zhejiang,Hangzhou
杭州浙江日报社店,杭州市,"下城区, 浙江日报社一楼, 丰潭路380号",120.17,30.27,Zhejiang,Hangzhou
杭州银泰城西二店,杭州市,"西湖区, 银泰城1F016~2F018, 湖墅南路240号1F",120.11,30.3,Zhejiang,Hangzhou
杭州宜家道店,杭州市,"拱墅区, 红石板商铺, 东新路822号中大银泰城一层L108单元",120.15,30.28,Zhejiang,Hangzhou
杭州中大银泰城店,杭州市,"下城区, 中大银泰城, 丰潭路380号",120.18,30.33,Zhejiang,Hangzhou
杭州银泰城西一店,杭州市,"西湖区, 银泰城1F066~068, 文一路296号",120.11,30.3,Zhejiang,Hangzhou
杭州文一汇和城店,杭州市,"西湖区, 杭州文一汇和城, 朝晖路108号102室商铺",120.12,30.29,Zhejiang,Hangzhou
杭州和平饭店店,杭州市,"下城区, 和平饭店, 西湖区杭大路1号黄龙世纪广场",120.18,30.28,Zhejiang,Hangzhou
杭州黄龙世纪广场店,杭州市,"浙江省杭州市, B区一层15号室, 江南大道3588号、火炬大道499号",120.14,30.27,Zhejiang,Hangzhou
杭州恒生电子店,杭州市,"浙江省杭州市滨江区, 2幢B101、B102单元, 文二路333号大华华领国际大厦",120.17,30.19,Zhejiang,Hangzhou
杭州大华华领国际店,杭州市,"西湖区, 大华华领国际, 景昙路18-26号",120.12,30.28,Zhejiang,Hangzhou
杭州银泰庆春店,杭州市,"江干区, 银泰百货庆春店一楼, 庆春路122号",120.2,30.26,Zhejiang,Hangzhou
杭州庆春路店,杭州市,"下城区, 嘉德广场1楼, 延安路385号嘉里中心购物中心4层L419b号单元",120.17,30.26,Zhejiang,Hangzhou
杭州嘉里中心4F店,杭州市,"杭州市下城区, 圣塘景区8号",120.16,30.26,Zhejiang,Hangzhou
杭州石函店,杭州市,"西湖区, 石函精舍, 绍兴路161号野风现代中心一层",120.16,30.26,Zhejiang,Hangzhou
杭州野风现代中心店,杭州市,"下城区, 杭州野风现代中心, 西湖文化广场",120.18,30.29,Zhejiang,Hangzhou
杭州西湖文化广场店,杭州市,"下城区, 18号1楼1A-09号, 南山路147号6号楼",120.16,30.28,Zhejiang,Hangzhou
杭州西湖天地店,杭州市,"上城区, 西湖天地, 莫干山路街1509号",120.16,30.25,Zhejiang,Hangzhou
杭州西田城购物中心店,杭州市,"杭州市余杭区, 西田城购物中心一层A1F-008-1商铺, 余杭区五常大道1号",120.09,30.34,Zhejiang,Hangzhou
