StoreName,CityName,Street Address,Longitude,Latitude,province,cityE
北京西站第一咖啡店,北京市,"丰台区, 北京西站通廊7-1号, 中关村南大街2号",116.32,39.9,Beijing,Beijing
北京华宇时尚店,北京市,"海淀区, 数码大厦B座华宇时尚购物中心内, 蓝色港湾国际商区1座C1-3单元首层、",116.32,39.97,Beijing,Beijing
北京蓝色港湾圣拉娜店,北京市,"朝阳区朝阳公园路6号, 二层C1-3单元及二层阳台, 太阳宫中路12号",116.47,39.95,Beijing,Beijing
北京太阳宫凯德嘉茂店,北京市,"朝阳区, 太阳宫凯德嘉茂一层01-44/45号, 东三环北路27号",116.45,39.97,Beijing,Beijing
北京东三环北店,北京市,"朝阳区, 嘉铭中心大厦A座B1层024商铺, 金融大街7号",116.46,39.93,Beijing,Beijing
北京英蓝国际店,北京市,"西城区, 英蓝国际金融中心首层F111-F112单元, 建国门内大街18号",116.36,39.92,Beijing,Beijing
北京建国门内大街店,北京市,"东城区, 恒基中心一层039单元, 北清路1号院1号楼",116.43,39.91,Beijing,Beijing
北京北清路永旺商城店,北京市,"昌平区, 永旺国际商城购物中心1层NO.120区域, 建内大街19号",116.29,40.1,Beijing,Beijing
北京新闻大厦店,北京市,"东城区, 新闻大厦1层, 酒仙桥路12号",116.42,39.91,Beijing,Beijing
北京酒仙桥路咖啡店,北京市,"朝阳区, 乐天玛特超市1层LJ02-50单元, 建国门外大街丙12号",116.49,39.98,Beijing,Beijing
北京宝钢大厦店,北京市,"朝阳区, 宝钢大厦1层, 惠新东街钱柜一层",116.45,39.91,Beijing,Beijing
北京惠新东街咖啡店,北京市,"惠新东街4号, 广渠家园3号楼1层",116.42,39.99,Beijing,Beijing
北京广渠门名敦道店,北京市,"东城区, 新中街瑞士公寓1、2层L103&L202A",116.45,39.89,Beijing,Beijing
北京新中街瑞士公寓店,北京市,"东城区, 西单北大街176号",116.44,39.93,Beijing,Beijing
北京西单汉光百货商场店,北京市,"西城区, 光百货一层101商铺, 西小口路66号",116.38,39.91,Beijing,Beijing
北京西小口路店,北京市,"海淀区, 中关村东升科技园B区6号楼C座一层101, 九棵树西路80号",116.36,40.05,Beijing,Beijing
北京通州九棵树西路店,北京市,"通州区, 北京通州阳光新生活广场一层8-A单元, 复兴路69号",116.66,39.89,Beijing,Beijing
北京五棵松第二咖啡店,北京市,"海淀区, 3号楼5层（05）502-5C015单元, 首都国际机场2号航站楼国际隔离区内",116.28,39.91,Beijing,Beijing
北京首都国际机场3店,北京市,"顺义区, 丰科路6号院",116.6,40.08,Beijing,Beijing
丰科路万达广场店,北京市,"北京市, 第一层1056号和1057号商铺, 阜通东大街",116.3,39.82,Beijing,Beijing
北京阜通东大街二店,北京市,"朝阳区, 1号院6号楼1层2112, 北四环东路73号",116.48,40.0,Beijing,Beijing
北京北四环东路咖啡店,北京市,"朝阳区, 远洋未来广场一层31单元, 东方东路19号",116.43,39.99,Beijing,Beijing
北京东方东路二店,北京市,"朝阳区, 外交办公大楼1层F110&2层F213, 复兴路29号",116.46,39.95,Beijing,Beijing
北京翠微广场店,北京市,"海淀区, 翠微广场购物中心地上一层110号商铺, 南锣鼓巷20号",116.31,39.91,Beijing,Beijing
北京南锣鼓巷咖啡店,北京市,"东城区, 亦庄经济技术开发区",116.4,39.94,Beijing,Beijing
北京同济南路店,北京市,"大兴区, 同济南路1号院, 王府井大街253号",116.53,39.78,Beijing,Beijing
北京王府井店,北京市,"东城区, 王府井百货大楼首层, 崇文门外大街40号",116.41,39.91,Beijing,Beijing
北京崇文门外第二咖啡店,北京市,"东城区, 搜秀城一层, 东三环北路甲19 号",116.42,39.9,Beijing,Beijing
北京嘉盛SOHO中心店,北京市,"朝阳区, 嘉盛中心首层西侧大堂, 西大望路1号",116.46,39.93,Beijing,Beijing
北京西大望路温特莱店,北京市,"朝阳区, 温特莱中心一层, 首都国际机场1号航站楼",116.48,39.91,Beijing,Beijing
北京首都国际机场1店,北京市,"顺义区, 一层公共区东侧, 王府井大街138号",116.59,40.08,Beijing,Beijing
北京新东安店,北京市,"东城区, 新东安广场地下一层B111-B112号店铺, 前门大街1-1号",116.41,39.92,Beijing,Beijing
北京前门大街店,北京市,"崇文区, 方庄紫芳园四区3号楼",116.4,39.9,Beijing,Beijing
北京紫芳园咖啡店（方庄璞瑅）,北京市,"丰台区, 7号商铺, 上地三街9号",116.44,39.86,Beijing,Beijing
北京上地三街咖啡店,北京市,"海淀区, B座B-1号及B座首层玻璃间, 德胜门外大街83号",116.31,40.04,Beijing,Beijing
北京德外大街咖啡店,北京市,"西城区, 1层102号, 望京东园七区",116.38,39.96,Beijing,Beijing
北京望京东园二店,北京市,"朝阳区, 望京保利国际广场T1一层101单元, 羊坊店路18号",116.49,40.0,Beijing,Beijing
北京羊坊店路咖啡店,北京市,"光耀东方广场一层103单元, 海淀区, 丰台北路18号院",116.32,39.9,Beijing,Beijing
北京丽泽桥恒泰咖啡店,北京市,"丰台区, 恒泰广场一层L1-19-20, 东四环南路9号",116.31,39.87,Beijing,Beijing
北京燕莎奥特莱斯店,北京市,"朝阳区, 燕莎奥特莱斯购物中心二期C座一层1018#, 西单北大街110号",116.49,39.88,Beijing,Beijing
北京西单北大街咖啡店,北京市,"西城区, L2-2.23号, 霄云路甲26号",116.37,39.91,Beijing,Beijing
北京霄云路咖啡店,北京市,"朝阳区, 酒店一层, 建国门外大街甲5号",116.47,39.96,Beijing,Beijing
北京贵友大厦店,北京市,"朝阳区, 贵友大厦东侧, 东坝中路38号一层",116.45,39.91,Beijing,Beijing
北京金隅嘉品店,北京市,"朝阳区, L126、L127a、L129a单元, 建国门外大街甲6号1幢",116.55,39.95,Beijing,Beijing
北京爱思开大厦店,北京市,"朝阳区, SK大厦2层, 望京东园四区",116.46,39.91,Beijing,Beijing
北京望京东园店,北京市,"朝阳区, 9号楼1层101-1号, 三里屯路19号院",116.49,40.0,Beijing,Beijing
北京三里屯店,北京市,"朝阳区, 10号楼10-10&10-20, 北京市朝阳区阜通东大街6号院",116.45,39.93,Beijing,Beijing
北京阜通东大街咖啡店,北京市,"朝阳区, 3号楼物业一层1-101单元, 北京火车站",116.48,39.99,Beijing,Beijing
北京站第一咖啡店,北京市,"东城区, 出发层, 中关村南大街18号",116.43,39.9,Beijing,Beijing
北京中关村南大街咖啡店,北京市,"海淀区, 北京国际大厦一层C座01-101单元, 东大桥东侧路光华路9号",116.32,39.95,Beijing,Beijing
北京世贸天阶店,北京市,"朝阳区, 世贸天阶中心A座一层L123号, 翠微路12号01层",116.45,39.92,Beijing,Beijing
北京翠微路咖啡店,北京市,"海淀区, 101-06/44/K12B号, 西大街107号",116.3,39.91,Beijing,Beijing
北京中海国际大厦咖啡店,北京市,"西城区, 中海国际大厦28号楼 1层6-7单元, 中关村大街1号1号楼1层F100号铺位",116.36,39.93,Beijing,Beijing
北京中关村大街海龙大厦,北京市,"海淀区, 方庄芳古园一区28号楼",116.32,39.98,Beijing,Beijing
北京方庄通润商务会馆店,北京市,"丰台区, 通润商务会馆A段1层2单元, 天畅园7号楼1层108号",116.43,39.87,Beijing,Beijing
北京天畅园咖啡店,北京市,"朝阳区, 宣武门外大街8号",116.42,40.03,Beijing,Beijing
北京庄胜崇光店,北京市,"宣武区, 北京庄胜崇光百货新馆B1层, 朝阳区东三环南路1号",116.38,39.9,Beijing,Beijing
北京东三环南路店,北京市,"北京市, 佳龙大厦101, 古北口镇司马台村国际休闲旅游度假区",116.46,39.89,Beijing,Beijing
北京古北咖啡店,北京市,"密云县, 第一层101单元, 建国门外大街22号",117.28,40.65,Beijing,Beijing
北京赛特购物中心店,北京市,"朝阳区, 赛特购物中心地下一层扶梯东侧, 大成南里三区13号楼",116.44,39.91,Beijing,Beijing
北京大成路店,北京市,"丰台区, 零售商区的一层及负一层的01单元, 新华西路58号1号楼",116.27,39.89,Beijing,Beijing
北京通州万达广场第一店,北京市,"通州区, 通州万达广场地上一层1057号铺位, 来广营西路5号院",116.64,39.91,Beijing,Beijing
北京望京诚盈中心店,北京市,"朝阳区, 3号楼地上一层102A, 复兴门大街15号",116.47,40.02,Beijing,Beijing
北京三里河东路店,北京市,"西城区, 长安商场1层, 永定门西滨河路8号院7楼",116.35,39.91,Beijing,Beijing
北京永定门咖啡店,北京市,"东城区, 中海地产广场101东塔02单元, 永大路1号楼102室",116.39,39.87,Beijing,Beijing
北京龙湖时代天街店,北京市,"大兴区, 东三环中路39号",116.32,39.69,Beijing,Beijing
北京建外现代城店,北京市,"朝阳区, 建外SOHO5号别墅01户, 西单北大街131号",116.46,39.91,Beijing,Beijing
北京西单大悦城店,北京市,"西城区, 西单大悦城2F-33号商铺, 香江北路28号2-023",116.37,39.91,Beijing,Beijing
北京赛特奥特莱斯店,北京市,"朝阳区, 东三环中路7号院7楼1-31号",116.51,40.04,Beijing,Beijing
北京财富购物中心店,北京市,"朝阳区, 建国路甲92号北京世茂大厦首层102#单元",116.46,39.92,Beijing,Beijing
北京世茂大厦店,北京市,"朝阳区, 槐房南路6号院",116.47,39.91,Beijing,Beijing
北京槐房西路店,北京市,"丰台区, 槐房万达广场一层1083号, 临空经济核心区安泰大街9号院",116.37,39.82,Beijing,Beijing
北京祥云东方苑咖啡店,北京市,"顺义区, 10号楼102号, 复兴门内大街28号",116.53,40.09,Beijing,Beijing
北京复兴门内店,北京市,"西城区, 凯晨世贸中心西大堂东南侧, 东长安街1号P-W1(08-10)号店铺",116.36,39.91,Beijing,Beijing
北京东方广场三店,北京市,"东城区, 北京东方广场东方新天地商场平台层, 金宝街88号",116.41,39.91,Beijing,Beijing
北京金宝汇店,北京市,"东城区, 金宝汇112号商铺一层, 什刹海前海西沿甲19号",116.42,39.92,Beijing,Beijing
北京什刹海天荷坊店,北京市,"西城区, 北京南站",116.39,39.93,Beijing,Beijing
北京南站第五咖啡店,北京市,"丰台区, 北进口内测东部通道区域地上一层的单元, 金汇路",116.38,39.87,Beijing,Beijing
北京金汇路世界城店,北京市,"朝阳区, 世界城商业街9号楼1层W111单元, 复兴门内大街158号",116.45,39.92,Beijing,Beijing
北京西城远洋大厦店,北京市,"西城区, 远洋大厦首层G03A, 崇文门外大街18号",116.36,39.91,Beijing,Beijing
北京崇文门外第一咖啡店,北京市,"东城区, 国瑞城地下二层, 复兴路51号",116.42,39.9,Beijing,Beijing
北京复兴路咖啡店,北京市,"海淀区, 凯德精品商场1层西侧, 北京市通州区云景东路1号",116.3,39.91,Beijing,Beijing
北京通州贵友店,北京市,"通州区, 贵友大厦地上一层, 海淀大街3号",116.67,39.88,Beijing,Beijing
北京海淀鼎好电子大厦店,北京市,"海淀区, 鼎好电子大厦1层, 北三环东路36号2号楼C-05单元",116.31,39.98,Beijing,Beijing
北京环球贸易中心店,北京市,"东城区, 将台路丽都广场丽都商厦首层",116.41,39.97,Beijing,Beijing
北京丽都店,北京市,"朝阳区, 西红门镇",116.48,39.98,Beijing,Beijing
北京欣宁大街咖啡店,北京市,"大兴区, 欣宁大街15号1层1-01-28-R号, 朝阳门外大街甲6号",116.33,39.79,Beijing,Beijing
北京朝外大街咖啡店,北京市,"朝阳区, 一层2011,2012号商铺, 工人体育场北路13号",116.46,39.92,Beijing,Beijing
北京工体北路店,北京市,"朝阳区, 北京世茂百货F1层E103, 文化园东路6号01C01",116.45,39.94,Beijing,Beijing
北京文化园东路店,北京市,"经济技术开发区, 首都机场3号航站楼",116.5,39.81,Beijing,Beijing
北京首都国际机场5店,北京市,"顺义区, 到达大厅A2LE08#, 翠景北里21号楼",116.62,40.06,Beijing,Beijing
北京翠景北里咖啡店,北京市,"通州区, 南竹杆胡同1号地下1层",116.66,39.89,Beijing,Beijing
北京朝阳门SOHO店,北京市,"东城区, B-123号铺, 万博苑7号楼1层",116.43,39.92,Beijing,Beijing
北京万博苑咖啡店,北京市,"西城区, 东三环北路霞光里18号",116.36,39.87,Beijing,Beijing
北京霞光里店,北京市,"潮阳区, 佳程广场平台层, 太平桥大街18号",116.46,39.96,Beijing,Beijing
北京太平桥大街咖啡店,北京市,"西城区, 丰融国际203号, 良乡北关西路14号",116.37,39.92,Beijing,Beijing
北京房山北关西路咖啡店,北京市,"房山区, 华冠购物中心一层, 复兴路69号3号楼1层（01）101号001单元",116.14,39.74,Beijing,Beijing
北京五棵松卓展店,北京市,"海淀区, 朝阳门外大街",116.28,39.91,Beijing,Beijing
北京丰联广场店,北京市,"朝阳区, 丰联广场一层, 广安门外大街168号",116.44,39.92,Beijing,Beijing
北京朗琴国际大厦咖啡店,北京市,"西城区, 天虹百货商场1层101-1号, 东三环中路一号",116.34,39.89,Beijing,Beijing
北京环球金融中心店,北京市,"朝阳区, 环球金融中心首层W102, 北辰东路8号院",116.46,39.92,Beijing,Beijing
北京北辰东路第三咖啡店,北京市,"朝阳区, 1号楼一层108单元, 清河嘉园东区甲1号楼",116.41,39.99,Beijing,Beijing
北京清河嘉园东区咖啡店,北京市,"海淀区, 清河翠微百货一层101-01单元, 曙光西里甲5号院",116.35,40.03,Beijing,Beijing
北京曙光西里咖啡店,北京市,"朝阳区, 10号楼-17-1层17, 朝阳北路",116.46,39.96,Beijing,Beijing
北京青年路第二咖啡店,北京市,"朝阳区, 101号楼5层5F-48, 北京首都国际机场T3航站楼4层公共区",116.52,39.92,Beijing,Beijing
北京首都机场11店,北京市,"朝阳区, 工人体育场北路甲2号裙房01层103A",116.62,40.06,Beijing,Beijing
北京盈科中心第二咖啡店,北京市,"朝阳区, 单元及02层202A、203A单元, 建国门外大街乙12号",116.46,39.93,Beijing,Beijing
北京LG大厦店,北京市,"朝阳区, 北京双子座大厦首层L118, 大红门西路26号11号",116.45,39.91,Beijing,Beijing
北京大红门西路店,北京市,"丰台区, 商业楼首层L1-01单元, 北京南站",116.39,39.84,Beijing,Beijing
北京南站第六咖啡店,北京市,"丰台区, 换乘层7号出站口北侧区域的单元, 朝阳北路101号楼",116.38,39.86,Beijing,Beijing
北京青年路三店,北京市,"朝阳区, 北京朝阳大悦8层, 朝阳门内大街2号B座一层04单元",116.52,39.93,Beijing,Beijing
北京凯恒店,北京市,"东城区, 远大路1号",116.43,39.92,Beijing,Beijing
北京远大路第三咖啡店,北京市,"海淀区, 金源燕莎mall首层, 中关村大街19号",116.29,39.96,Beijing,Beijing
北京海淀新中关大厦店,北京市,"海淀区, 新中关大厦首层L128A号, 建国路93号院A座万达广场东区",116.32,39.98,Beijing,Beijing
北京万达广场店,北京市,"朝阳区, 新世界彩旋百货首层, 东北旺西路8号",116.47,39.91,Beijing,Beijing
北京东北旺西路咖啡店,北京市,"海淀区, 4号楼一层101-01, 阜石路300号",116.3,40.05,Beijing,Beijing
北京阜石路第一咖啡店,北京市,"石景山区, 一层101单元, 莲宝中路西侧",116.17,39.92,Beijing,Beijing
北京万丰路咖啡店,北京市,"丰台区, 万丰路68号和谐广场一层, 东四环中路56号",116.3,39.88,Beijing,Beijing
北京远洋天地店,北京市,"朝阳区, 远洋国际中心A座首层109号单元, 远大路1号",116.49,39.91,Beijing,Beijing
北京远大路金源燕莎2店,北京市,"海淀区, 北京燕莎友谊商城金源店地下一层, 苏州街3号，+C148",116.29,39.96,Beijing,Beijing
北京大恒科技大厦店,北京市,"海淀区, 大恒科技大厦首层, 王府井大街301号",116.31,39.98,Beijing,Beijing
北京金街咖啡店,北京市,"东城区, 新燕莎金街购物中心一层MF105-1、MF105-2商铺, 日坛路6号",116.41,39.91,Beijing,Beijing
北京新族大厦店,北京市,"朝阳区, 新族大厦首层1B, 太阳宫中路12号",116.44,39.91,Beijing,Beijing
北京太阳宫中路第二店,北京市,"朝阳区, 大堂第一层, 北京南站",116.45,39.97,Beijing,Beijing
北京南站第二咖啡店,北京市,"丰台区, 换乘层中区商业面向地铁南口西侧, 清华东路2号",116.38,39.86,Beijing,Beijing
北京金码大厦店,北京市,"海淀区, 金码大厦A座首层, 建国路93号",116.35,40.0,Beijing,Beijing
北京万达广场2店,北京市,"朝阳区, 万达广场B座3层, 建国路89号院",116.47,39.91,Beijing,Beijing
北京华贸二店,北京市,"朝阳区, 北京华贸19号楼一层102单元, 空港街道安泰大街6号院",116.48,39.91,Beijing,Beijing
北京祥云东方苑二店,北京市,"顺义区, 11号楼107, 北兴路2号1幢",116.54,40.09,Beijing,Beijing
北京大兴星光影视基地店,北京市,"大兴区, 上地东路1号院7号楼",116.36,39.77,Beijing,Beijing
北京上地东路店,北京市,"海淀区, 环洋大厦1层东101单元, 丰葆路88号",116.3,40.05,Beijing,Beijing
北京丰葆路店,北京市,"丰台区, 1号楼, 中关村大街11号一层A1500A单元",116.29,39.82,Beijing,Beijing
北京中关村亿世界店,北京市,"海淀区, 西红门宏福路",116.32,39.98,Beijing,Beijing
北京宏福路咖啡店,北京市,"大兴区, 鸿坤生活广场一层, 金融大街9号楼",116.34,39.79,Beijing,Beijing
北京金融大街店,北京市,"西城区, 1层106-01单元, 东直门48号银座广场",116.36,39.92,Beijing,Beijing
北京东直门第一咖啡店,北京市,"东城区, L3层23号商铺, 金宝街89号",116.44,39.94,Beijing,Beijing
北京东城区金宝大厦店,北京市,"东城区, 金宝大厦写字楼一层04商铺, 七圣中街12号院2号楼",116.42,39.92,Beijing,Beijing
北京七圣中街咖啡店,北京市,"朝阳区, 爱琴海购物中心一层101内F1007, 霄云路36号",116.44,39.97,Beijing,Beijing
北京国航大厦店,北京市,"朝阳区, 国航大厦一层, 丰北路甲79号楼",116.46,39.96,Beijing,Beijing
北京丰北路咖啡店,北京市,"丰台区, 华堂商场1层1-001单元, 天竺房地产开发区",116.29,39.87,Beijing,Beijing
北京日祥广场店,北京市,"顺义区, 日祥广场, 东方东路19号外交公寓A座会所2号商铺",116.55,40.06,Beijing,Beijing
北京东方东路外交公寓店,北京市,"朝阳区, 龙山东路2号院",116.46,39.95,Beijing,Beijing
北京龙山东路咖啡店,北京市,"怀柔区, 1号楼一层03单元, 朝阳公园6号11号楼",116.63,40.32,Beijing,Beijing
北京蓝色港湾第二咖啡店,北京市,"朝阳区, 成府路28号",116.48,39.95,Beijing,Beijing
北京五道口购物中心店,北京市,"海淀区, 1层101-10B及2层201-09号, 永定门外大街",116.34,39.99,Beijing,Beijing
北京南站第一咖啡店,北京市,"丰台区, 北京南站首层, 三丰北里5号楼",116.38,39.86,Beijing,Beijing
北京朝外第二店,北京市,"朝阳区, 01层（01）101中119号, 北辰东路8号1号楼B07",116.44,39.92,Beijing,Beijing
北京北辰东路店,北京市,"朝阳区, 朝阳北路101号楼L1-02号",116.41,39.99,Beijing,Beijing
北京朝阳大悦城店,北京市,"朝阳区, 科学院南路6号",116.52,39.92,Beijing,Beijing
北京科学院南路店,北京市,"海淀区, 融科资讯中心B座1层019单元, 北辰东路8号院",116.33,39.98,Beijing,Beijing
北京北辰东路第二咖啡店,北京市,"朝阳区, 16号楼一层101单元, 京顺路111号",116.41,39.99,Beijing,Beijing
北京京顺路咖啡店,北京市,"朝阳区, 比如世界京顺路店首层05号, 呼家楼1号",116.46,39.97,Beijing,Beijing
北京呼家楼咖啡店,北京市,"朝阳区, 京广商务中心1层, 东三环中路5号楼",116.46,39.92,Beijing,Beijing
北京财富中心三店,北京市,"朝阳区, 北京财富金融中心B1层, 石景山路乙18号院4号楼",116.46,39.92,Beijing,Beijing
北京石景山万达广场店,北京市,"北京市, 石景山万达广场一层, 上地西路6号",116.23,39.91,Beijing,Beijing
北京上地西路咖啡店,北京市,"海淀区, 联想科技园区内, 大兴区旧宫忠凉路1号院1号楼",116.3,40.05,Beijing,Beijing
北京旧宫万科咖啡店,北京市,"北京市, 住总万科广场一层L1001、L1002号, 东三环中路7号",116.46,39.81,Beijing,Beijing
北京财富中心店,北京市,"朝阳区, 财富中心一期写字楼首层E103, 建国路91号",116.46,39.92,Beijing,Beijing
北京金地中心店,北京市,"朝阳区, 金地中心L2层L201店铺, 建国路79号",116.47,39.91,Beijing,Beijing
北京华贸店,北京市,"朝阳区, 北京华贸购物中心L121及L223&224#, 颐和园路206号206-14、15、16",116.48,39.91,Beijing,Beijing
北京龙湖天街店,北京市,"海淀区, 西大望路15号",116.29,40.0,Beijing,Beijing
北京西大望路第一店,北京市,"朝阳区, 4号楼商业1（01层）内01号, 西四环南路103号院1号",116.48,39.89,Beijing,Beijing
北京西四环南路咖啡店,北京市,"丰台区, 资和信百货商场F1-1024, 南四环西路118号一区31号楼",116.29,39.84,Beijing,Beijing
北京南四环西路咖啡店,北京市,"丰台区, 1层（01）101区域内的01单元, 东大桥路9号",116.29,39.83,Beijing,Beijing
北京芳草地大厦咖啡店,北京市,"朝阳区, D座一层, 清河中街68号",116.45,39.92,Beijing,Beijing
北京五彩城店,北京市,"海淀区, 五彩城西区首层L101号商铺, 北辰西路8号院3号楼B座",116.33,40.03,Beijing,Beijing
北京北辰西路店,北京市,"朝阳区, 北辰世纪中心首层109单元, 新源南路1号",116.39,40.0,Beijing,Beijing
北京新源南路咖啡店,北京市,"朝阳区, 1至4层101内-1层B18单元, 中关村大街15-11号A区",116.46,39.95,Beijing,Beijing
北京中关村广场西区店,北京市,"海淀区, 负一层A126、A127单元, 望京湖光中街1号",116.31,39.98,Beijing,Beijing
北京望京鹏景阁店,北京市,"朝阳区, 鹏景阁首层, 立汤路186号院",116.47,40.0,Beijing,Beijing
北京龙德广场二店,北京市,"昌平区, 1号楼02层(02)201内208单元, 霄云路38号",116.42,40.06,Beijing,Beijing
北京霄云路二店,北京市,"朝阳区, 现代汽车大厦一层, 首都机场三号航站楼A3E4",116.46,39.96,Beijing,Beijing
北京首都国际机场9店,北京市,"朝阳区, 3层, 建国门外大街 光华路1号",116.62,40.06,Beijing,Beijing
北京嘉里中心第二咖啡店,北京市,"朝阳区, 北京嘉里中心商场一层111号，2层204号, 东城区东直门南大街3号",116.46,39.91,Beijing,Beijing
北京国华投资广场咖啡店,北京市,"北京市, 国华投资一层01单元, 建国门外大街1号",116.43,39.94,Beijing,Beijing
北京国贸四店,北京市,"朝阳区, 国际贸易中心商城地下一层SB126+SB127号铺位, 东三环北路8号",116.46,39.91,Beijing,Beijing
北京亮马河大厦店,北京市,"朝阳区, 亮马大厦一层, 金融街金融中心F区",116.46,39.95,Beijing,Beijing
北京金融街金树街店,北京市,"西城区, 北京建国路112号",116.36,39.92,Beijing,Beijing
北京建国路第二咖啡店,北京市,"朝阳区, 一层B, 崇文门外大街3号",116.46,39.91,Beijing,Beijing
北京新世界店,北京市,"崇文区, 新世界商场一期首层, 宣武门外大街28号",116.42,39.9,Beijing,Beijing
北京宣武门外富卓大厦店,北京市,"西城区, 富卓大厦一层, 北京南站换乘层地铁四号线围栏外",116.38,39.89,Beijing,Beijing
北京南站第三咖啡店,北京市,"丰台区, 东北角，M与1/M轴之间、2-9与2-10轴之间, 清河营南街",116.38,39.87,Beijing,Beijing
北京清河营南街店,北京市,"朝阳区, 7号院4号楼一层126-127商铺, 复内大街101号",116.43,40.05,Beijing,Beijing
北京百盛店,北京市,"西城区, 复兴门百盛商场二期一层, 天坛东路46号",116.36,39.91,Beijing,Beijing
北京天坛东路店,北京市,"东城区, 迤北红桥市场一层, 北三环东路36号1号楼A座首层02单元",116.42,39.89,Beijing,Beijing
北京安贞环贸2店,北京市,"东城区, 南礼士路66号",116.41,39.97,Beijing,Beijing
北京建威大厦店,北京市,"西城区, 建威大厦一层, 酒仙桥路18号",116.35,39.91,Beijing,Beijing
北京颐堤港中心咖啡店,北京市,"朝阳区, 颐堤港商场L1-72号, 工人体育场北路",116.49,39.97,Beijing,Beijing
北京工体北路第二咖啡店,北京市,"朝阳区, 8号院1号楼1层1118, 西直门北大街32号院",116.45,39.93,Beijing,Beijing
北京枫蓝国际中心店,北京市,"海淀区, 1号楼一层106-2, ""西城区金融街武定候街2号 """,116.36,39.95,Beijing,Beijing
北京泰康国际大厦店,北京市,"西城区, 泰康大厦1层, 悦盛路6号院",116.36,39.92,Beijing,Beijing
北京房山悦盛路店,北京市,"房山区, 奥特莱斯F1-B06, 林翠东路2号院",116.19,39.76,Beijing,Beijing
北京奥村咖啡店,北京市,"朝阳区, 甲3号楼一层F106区域, 城南街道南口路29号",116.38,40.01,Beijing,Beijing
北京乐多港店,北京市,"昌平区, L1028, 东三环中路63号(双井桥西北侧)",116.19,40.23,Beijing,Beijing
北京富力家园店,北京市,"朝阳区, 富力大厦1层101, 三丰北里2号楼悠唐生活广场",116.46,39.9,Beijing,Beijing
北京朝外悠唐店,北京市,"朝阳区, 天竺镇丽苑街15号",116.44,39.92,Beijing,Beijing
北京顺义丽苑街咖啡店,北京市,"顺义区, 27号楼102,103单元, 首体南路9号10楼等11幢之第四幢",116.56,40.05,Beijing,Beijing
北京首体南路咖啡店,北京市,"海淀区, 地上一层大堂B/C轴与22/25轴之间, 新顺南大街11号",116.32,39.93,Beijing,Beijing
北京新顺南大街咖啡店,北京市,"顺义区, 1幢一层2单元, 建国门外大街2号",116.65,40.13,Beijing,Beijing
北京银泰店,北京市,"朝阳区, 银泰中心B1-B38&B39, 广顺南大街16号院1号楼",116.46,39.91,Beijing,Beijing
北京望京店,北京市,"朝阳区, 北京新世界利莹百货首层010760A, 天星街1号院",116.48,39.99,Beijing,Beijing
北京天星街咖啡店,北京市,"房山区, 7号楼一层, 玉泉路59号院1号楼",116.16,39.76,Beijing,Beijing
